<?xml version="1.0" encoding="UTF-8"?>

<!ELEMENT se (type+)>
<!ELEMENT type (windows*, linux*, macos*)>
<!ELEMENT windows (version?, dateCreation?, derniereMaj?)>
<!ELEMENT linux (version?, dateCreation?, derniereMaj?)>
<!ELEMENT macos (version?, dateCreation?, derniereMaj?)>
<!ELEMENT version (#PCDATA)>
<!ELEMENT dateCreation (#PCDATA)>
<!ELEMENT derniereMaj (#PCDATA)>

<!ATTLIST version nom CDATA #IMPLIED>
